{
  "snapshot_id": "2026_27_CURRENT_V1",
  "snapshot_type": "CURRENT",
  "season": "2026/27",
  "published_at": "2026-09-12T12:00:00Z",
  "immutable": true,
  "sporting_cutoff_at": "2026-09-12T00:00:00Z",
  "coverage": {
    "manifest_id": "COVERAGE_2026_27_V1",
    "editions": [{
      "edition_id": "example_league_2026_27",
      "competition_id": "example_league",
      "competition_name": "Example League",
      "season": "2026/27",
      "status": "in_progress",
      "start_at": "2026-08-01T00:00:00Z",
      "end_at": "2027-05-31T23:59:59Z",
      "match_set_hash": "d755966f16c31ae97161448968b63ccbc4ff1550758c44f196c9fb38c039e800",
      "covered_matches": [{ "match_id": "match_002", "finished_at": "2026-09-01T12:00:00Z" }]
    }],
    "exclusions": []
  }
}
